{
  "schema_version": "1.0",
  "description": "WT 标签体系（机器规格）——四维标签全量枚举。项目信息.json 的 tags 字段按本表取值：main 至少选 1，theme/role/plot 至多选 2。标签全量存储用于匹配判断与展示检索，不参与预设组合（预设为笼统叙事类型，见 data/plot-scenario-presets.json）。",
  "main": [
    { "id": "西方奇幻", "desc": "偏西方世界背景下，包含魔法斗气魔术等" },
    { "id": "东方仙侠", "desc": "偏东方世界背景下，包含修仙修道修真等" },
    { "id": "科幻末世", "desc": "末世、丧尸、星际、机甲、未来科技等" },
    { "id": "男频衍生", "desc": "影视剧男频同人小说" },
    { "id": "都市高武", "desc": "都市架空，全民拥有修炼体系、灵气复苏等" },
    { "id": "悬疑灵异", "desc": "男频探案、悬疑、恐怖、风水奇术等" },
    { "id": "悬疑脑洞", "desc": "脑洞向的悬疑灵异、破案探险类" },
    { "id": "抗战谍战", "desc": "抗战时期的军事战争和间谍情报的男频小说" },
    { "id": "历史古代", "desc": "以种田、朝堂、智谋、争霸、科举等为主" },
    { "id": "历史脑洞", "desc": "脑洞向历史，一般有金手指" },
    { "id": "都市种田", "desc": "重生年代文、职场商战文、种田建设等" },
    { "id": "都市脑洞", "desc": "拥有金手指系统的男频都市脑洞奇想" },
    { "id": "都市日常", "desc": "都市情感、现实生活等都市文" },
    { "id": "玄幻脑洞", "desc": "脑洞向玄幻" },
    { "id": "战神赘婿", "desc": "都市向战神，兵王文" },
    { "id": "动漫衍生", "desc": "游戏、动漫等偏二次元向的同人作品" },
    { "id": "游戏体育", "desc": "网游、竞技、体育及穿入游戏或世界游..." },
    { "id": "传统玄幻", "desc": "废柴逆袭，强者重生等传统玄幻，高武..." },
    { "id": "都市修真", "desc": "以修真为力量体系的都市文" }
  ],
  "theme": [
    "衍生", "综影视", "第一人称", "第四天灾", "搞笑轻松", "悬疑", "仕途", "天灾",
    "赛博朋克", "规则怪谈", "古代", "克苏鲁", "都市异能", "末日求生", "灵气复苏", "高武世界",
    "异世大陆", "东方玄幻", "谍战", "清朝", "宋朝", "断层", "武将", "国运",
    "综漫", "开局", "架空", "奇幻仙侠", "都市", "玄幻", "历史", "体育", "武侠"
  ],
  "role": [
    "多女主", "赘婿", "全能", "大佬", "大小姐", "特工", "游戏主播", "神探", "贵族", "皇帝",
    "单女主", "校花", "无女主", "女帝", "特种兵", "反派", "神医", "奶爸", "学霸", "天才",
    "腹黑", "扮猪吃虎"
  ],
  "plot": [
    "都市江湖", "风水秘术", "斩神衍生", "十日衍生", "西游衍生", "公版衍生", "红楼衍生", "甄嬛衍生",
    "如懿衍生", "惊悚游戏", "卡牌", "山海经", "捉鬼", "剑修", "废土", "副本",
    "黑科技", "无脑爽", "魂穿", "高手下山", "黑化", "迪化", "发家致富", "无后宫",
    "争霸", "1v1", "升级流", "灵魂互换", "科举", "封神", "四合院", "电竞",
    "双重生", "乡村", "同人", "打脸", "破案", "囤物资", "钓鱼", "网游",
    "奥特同人", "求生", "无敌", "九叔", "穿书", "聊天群", "大秦", "龙珠",
    "漫威", "神奇宝贝", "海贼", "火影", "职场", "明朝", "家庭", "三国",
    "末世", "直播", "无限流", "诸天万界", "大唐", "宠物", "外卖", "星际",
    "美食", "剑道", "盗墓", "灵异", "鉴宝", "系统", "神豪", "重生",
    "穿越", "二次元", "海岛", "娱乐圈", "空间", "推理", "洪荒"
  ]
}
